{
  "$schema": "https://json-schema.org/draft/2020-12/schema",
  "$id": "https://successbycs.local/forex/milestone-registry.schema.json",
  "title": "Forex milestone registry",
  "type": "object",
  "additionalProperties": false,
  "required": ["schema_version", "project", "repository", "triad_review_required", "completion_authority", "operator_summary", "allowed_statuses", "roadmap_phases", "milestones"],
  "properties": {
    "schema_version": {"const": "1.0.0"},
    "project": {"const": "Forex"},
    "repository": {"type": "string", "minLength": 1},
    "triad_review_required": {"type": "boolean"},
    "completion_authority": {"type": "string", "minLength": 1},
    "operator_summary": {"$ref": "#/$defs/operatorSummary"},
    "allowed_statuses": {"type": "array", "items": {"type": "string"}, "uniqueItems": true},
    "roadmap_phases": {
      "type": "array",
      "minItems": 3,
      "maxItems": 3,
      "items": {
        "type": "object",
        "additionalProperties": false,
        "required": ["id", "title", "milestone_ids", "purpose", "constraints"],
        "properties": {
          "id": {"type": "string", "minLength": 1},
          "title": {"type": "string", "minLength": 1},
          "milestone_ids": {"$ref": "#/$defs/stringArray"},
          "purpose": {"type": "string", "minLength": 1},
          "constraints": {"$ref": "#/$defs/stringArray"}
        }
      }
    },
    "milestones": {
      "type": "array",
      "minItems": 1,
      "items": {"$ref": "#/$defs/milestone"}
    }
  },
  "$defs": {
    "operatorSummary": {
      "type": "object",
      "additionalProperties": false,
      "required": ["purpose", "milestone_actions", "current_state"],
      "properties": {
        "purpose": {"type": "string", "minLength": 1},
        "milestone_actions": {"$ref": "#/$defs/stringArray"},
        "current_state": {
          "type": "object",
          "additionalProperties": false,
          "required": ["authoritative_record", "fields", "read_command", "non_duplication_rule"],
          "properties": {
            "authoritative_record": {"const": "project_state.json"},
            "fields": {"$ref": "#/$defs/stringArray"},
            "read_command": {"$ref": "#/$defs/stringArray"},
            "non_duplication_rule": {"type": "string", "minLength": 1}
          }
        }
      }
    },
    "stringArray": {"type": "array", "items": {"type": "string", "minLength": 1}},
    "command": {
      "type": "object",
      "additionalProperties": false,
      "required": ["id", "argv"],
      "properties": {
        "id": {"type": "string", "minLength": 1},
        "argv": {"type": "array", "minItems": 1, "items": {"type": "string", "minLength": 1}}
      }
    },
    "criterion": {
      "type": "object",
      "additionalProperties": false,
      "required": ["id", "description", "kind"],
      "properties": {
        "id": {"type": "string", "minLength": 1},
        "description": {"type": "string", "minLength": 1},
        "kind": {"enum": ["CAPABILITY", "VERIFICATION", "REAL_WORLD_PROOF", "SAFETY"]}
      }
    },
    "retainedEvidencePolicy": {
      "type": "object",
      "additionalProperties": false,
      "required": ["manifest_path", "manifest_sha256", "collector_revision", "drill_revision", "diagnostics_revision", "configuration_fingerprint", "runtime_payload_sha256", "rationale"],
      "properties": {
        "manifest_path": {"type": "string", "pattern": "^runs/evidence/M29/[^/]+/manifest\\.json$"},
        "manifest_sha256": {"type": "string", "pattern": "^[a-f0-9]{64}$"},
        "collector_revision": {"type": "string", "pattern": "^[a-f0-9]{40}$"},
        "drill_revision": {"type": "string", "pattern": "^[a-f0-9]{40}$"},
        "diagnostics_revision": {"type": "string", "pattern": "^[a-f0-9]{40}$"},
        "configuration_fingerprint": {"type": "string", "pattern": "^sha256:[a-f0-9]{64}$"},
        "runtime_payload_sha256": {
          "type": "object", "additionalProperties": false,
          "required": ["m20_demo_listener_service.payload", "m20_demo_trading_session.payload", "m20_postgres_audit_bridge.payload", "m20_discord_trade_notification.payload"],
          "properties": {
            "m20_demo_listener_service.payload": {"type": "string", "pattern": "^sha256:[a-f0-9]{64}$"},
            "m20_demo_trading_session.payload": {"type": "string", "pattern": "^sha256:[a-f0-9]{64}$"},
            "m20_postgres_audit_bridge.payload": {"type": "string", "pattern": "^sha256:[a-f0-9]{64}$"},
            "m20_discord_trade_notification.payload": {"type": "string", "pattern": "^sha256:[a-f0-9]{64}$"}
          }
        },
        "rationale": {"type": "string", "minLength": 1}
      }
    },
    "milestone": {
      "type": "object",
      "additionalProperties": false,
      "allOf": [{"if": {"required": ["retained_evidence_policy"]}, "then": {"properties": {"milestone_id": {"const": "M29"}}}}],
      "required": [
        "milestone_id", "title", "objective", "delivery_type", "proof_type", "dependencies",
        "entry_conditions", "from_state", "to_state", "scope", "out_of_scope",
        "operator_config_affected", "expected_artifacts", "acceptance_criteria",
        "verification_commands", "real_world_proof", "evidence_requirements",
        "human_review_required", "proof_invalidated_by", "target_date", "target_date_owner", "notes"
      ],
      "properties": {
        "milestone_id": {"pattern": "^M(0|[1-9][0-9]*)$"},
        "title": {"type": "string", "minLength": 1},
        "objective": {"type": "string", "minLength": 1},
        "retained_evidence_policy": {"$ref": "#/$defs/retainedEvidencePolicy"},
        "delivery_type": {"enum": ["FOUNDATION_ENABLING", "CAPABILITY_DELIVERING", "RESEARCH_EVALUATION", "OPERATIONAL_SAFETY"]},
        "proof_type": {"enum": ["REPOSITORY_EXECUTION", "REAL_SYSTEM_INTEGRATION", "OPERATIONAL_DRILL", "EMPIRICAL_RESEARCH"]},
        "dependencies": {"$ref": "#/$defs/stringArray"},
        "entry_conditions": {"$ref": "#/$defs/stringArray"},
        "from_state": {"type": "string", "minLength": 1},
        "to_state": {"type": "string", "minLength": 1},
        "scope": {"$ref": "#/$defs/stringArray"},
        "out_of_scope": {"$ref": "#/$defs/stringArray"},
        "operator_config_affected": {"$ref": "#/$defs/stringArray"},
        "expected_artifacts": {"$ref": "#/$defs/stringArray"},
        "acceptance_criteria": {"type": "array", "minItems": 1, "items": {"$ref": "#/$defs/criterion"}},
        "verification_commands": {"type": "array", "minItems": 1, "items": {"$ref": "#/$defs/command"}},
        "real_world_proof": {
          "type": "object",
          "additionalProperties": false,
          "required": ["real_world_execution", "provenance_assurance", "surface", "capture_command", "verifier_command", "freshness_hours", "success_markers"],
          "properties": {
            "real_world_execution": {"const": true},
            "provenance_assurance": {"const": "SELF_ATTESTED_INTEGRITY"},
            "surface": {"type": "string", "minLength": 1},
            "capture_command": {"type": "array", "minItems": 1, "items": {"type": "string", "minLength": 1}},
            "verifier_command": {"type": "array", "minItems": 1, "items": {"type": "string", "minLength": 1}},
            "freshness_hours": {"type": "integer", "minimum": 1},
            "success_markers": {"type": "array", "minItems": 1, "items": {"type": "string", "minLength": 1}}
          }
        },
        "evidence_requirements": {"$ref": "#/$defs/stringArray"},
        "human_review_required": {"type": "boolean"},
        "proof_invalidated_by": {"$ref": "#/$defs/stringArray"},
        "target_date": {"type": ["string", "null"], "format": "date"},
        "target_date_owner": {"const": "HUMAN_OPERATOR"},
        "notes": {"type": "string"}
        ,
        "review_board_required": {"type": "boolean"},
        "triad_completion_recommendation_required": {"type": "boolean"},
        "work_packages": {
          "type": "array",
          "minItems": 1,
          "items": {
            "type": "object",
            "additionalProperties": false,
            "required": ["work_package_id", "title", "dependencies", "acceptance_criteria"],
            "properties": {
              "work_package_id": {"pattern": "^M[0-9]+\\.[0-9]+$"},
              "title": {"type": "string", "minLength": 1},
              "dependencies": {"$ref": "#/$defs/stringArray"},
              "acceptance_criteria": {"type": "array", "minItems": 1, "items": {"type": "string", "minLength": 1}}
            }
          }
        }
      }
    }
  }
}
