{
  "schema_version": "1.0.0",
  "project": "Forex",
  "repository": "successbycs/forex",
  "triad_review_required": false,
  "completion_authority": "Only proven_at, generated by the prove command after every gate passes, is an actual completion date.",
  "operator_summary": {
    "purpose": "Milestone contracts for the historical-first EUR/USD research path. Read this summary first, then use each active milestone's scope, acceptance criteria, fixed verification and real-world proof contract.",
    "milestone_actions": [
      "Inspect the current state and active contract before work.",
      "Implement the active milestone only and retain required artifacts.",
      "Run the fixed verification commands and capture the declared real-world proof.",
      "Independently verify the retained proof, record checks and evidence, obtain the required review and human decision, then prove the milestone.",
      "Start the next milestone only after the current one is proven or has an explicitly recorded human exception."
    ],
    "current_state": {
      "authoritative_record": "project_state.json",
      "fields": [
        "phase",
        "current_milestone",
        "next_milestone",
        "last_proven_milestone",
        "implementation_status",
        "known_blockers",
        "milestones.<id>.status",
        "milestones.<id>.proven_at"
      ],
      "read_command": [
        "python3 scripts/forex_milestones.py show --id <active-milestone>",
        "python3 scripts/forex_milestones.py validate"
      ],
      "non_duplication_rule": "This registry intentionally does not copy mutable status, timestamps, evidence or completion claims. project_state.json is the current execution summary; the registry remains the fixed contract."
    }
  },
  "allowed_statuses": [
    "PLANNED",
    "READY",
    "IN_PROGRESS",
    "BLOCKED",
    "NEEDS_FIX",
    "AWAITING_REAL_WORLD_PROOF",
    "AWAITING_HUMAN_SIGNOFF",
    "PROVEN",
    "NEEDS_REVALIDATION",
    "SUPERSEDED"
  ],
  "milestones": [
    {
      "milestone_id": "M0",
      "title": "Repository foundation proven",
      "objective": "Establish and clean-environment-prove a configuration-first, evidence-gated repository.",
      "delivery_type": "FOUNDATION_ENABLING",
      "proof_type": "REPOSITORY_EXECUTION",
      "dependencies": [],
      "entry_conditions": [
        "The Forex checkout exists and unrelated worktree changes are preserved."
      ],
      "from_state": "The milestone capability is not yet proven.",
      "to_state": "Repository foundation proven",
      "scope": [
        "Establish and clean-environment-prove a configuration-first, evidence-gated repository, including the fixed M1 preparation probe for bounded Demo historical EUR/USD export."
      ],
      "out_of_scope": [
        "Live trading and access to GOMarketsMU-Live.",
        "Capabilities assigned to later milestones, except for the explicitly fixed M1 preparation probe."
      ],
      "operator_config_affected": [
        "config/project.yaml",
        "config/runtime.yaml",
        "config/mt5.yaml",
        "config/market_data.yaml",
        "config/logging.yaml",
        "config/triad.yaml",
        "config/t480.json",
        "t480/command-catalog.json",
        "milestone_registry.json"
      ],
      "expected_artifacts": [
        "README.md",
        "AGENTS.md",
        "pyproject.toml",
        ".gitignore",
        ".env.example",
        "src/forex/__init__.py",
        "src/forex/config/__init__.py",
        "src/forex/triad.py",
        "src/forex/t480_dependency.py",
        "config/project.yaml",
        "config/runtime.yaml",
        "config/mt5.yaml",
        "config/market_data.yaml",
        "config/logging.yaml",
        "docs/project_brain.md",
        "docs/architecture.md",
        "docs/development_platform.md",
        "docs/implementation_plan.md",
        "docs/codex_guardrails.md",
        "docs/definition_of_done.md",
        "docs/decisions.md",
        "docs/security_model.md",
        "docs/testing_strategy.md",
        "docs/configuration.md",
        "docs/evidence_and_milestones.md",
        "docs/m0_closeout.md",
        "docs/triad_review.md",
        "reviews/README.md",
        "reviews/roles/ai_engineer.md",
        "reviews/roles/solution_architect.md",
        "reviews/roles/senior_software_developer.md",
        "reviews/roles/financial_domain_expert.md",
        "milestone_registry.json",
        "project_state.json",
        "runs/run_history.json",
        "src/forex/milestones.py",
        "scripts/verify_project.sh",
        "scripts/capture_m0_evidence.sh",
        "scripts/verify_m0_evidence.sh",
        "scripts/check_no_secrets.py",
        "scripts/forex_triad.py",
        "config/schemas/triad.schema.json",
        "config/schemas/triad-review-request.schema.json",
        "config/schemas/triad-review.schema.json",
        "config/schemas/triad-recommendation.schema.json",
        "config/t480.json",
        "t480/command-catalog.json",
        "t480/README.md",
        "scripts/t480_adapter.py",
        "tests/test_t480_adapter.py"
      ],
      "acceptance_criteria": [
        {
          "id": "M0-C1",
          "description": "Initial repository state and inspected reference repository revisions are documented truthfully.",
          "kind": "VERIFICATION"
        },
        {
          "id": "M0-C2",
          "description": "Retained Autonomous Framework concepts and deliberately excluded machinery are documented.",
          "kind": "VERIFICATION"
        },
        {
          "id": "M0-C3",
          "description": "Inspected AI Lab services, boundaries, networking constraints, and unresolved dependencies are documented without invented claims.",
          "kind": "VERIFICATION"
        },
        {
          "id": "M0-C4",
          "description": "Root AGENTS.md contains concise future-session operating rules.",
          "kind": "SAFETY"
        },
        {
          "id": "M0-C5",
          "description": "Python package installation succeeds in a fresh isolated environment without inherited system packages.",
          "kind": "REAL_WORLD_PROOF"
        },
        {
          "id": "M0-C6",
          "description": "Typed configuration loads and validates every initial YAML configuration file.",
          "kind": "CAPABILITY"
        },
        {
          "id": "M0-C7",
          "description": "Unknown fields, invalid runtime modes, forbidden server changes, and unsafe live flags fail validation.",
          "kind": "SAFETY"
        },
        {
          "id": "M0-C8",
          "description": "Configuration precedence and secret handling are documented and tested.",
          "kind": "SAFETY"
        },
        {
          "id": "M0-C9",
          "description": "Project state, milestone registry, run history, and evidence manifests validate through machine-readable JSON Schemas.",
          "kind": "VERIFICATION"
        },
        {
          "id": "M0-C10",
          "description": "Every registry milestone declares a real-world execution proof.",
          "kind": "REAL_WORLD_PROOF"
        },
        {
          "id": "M0-C11",
          "description": "Closeout refuses incomplete, stale, mismatched, dirty or proof-free milestones.",
          "kind": "SAFETY"
        },
        {
          "id": "M0-C12",
          "description": "A non-empty automated test suite passes.",
          "kind": "VERIFICATION"
        },
        {
          "id": "M0-C13",
          "description": "Repository-level verification passes.",
          "kind": "VERIFICATION"
        },
        {
          "id": "M0-C14",
          "description": "A fresh isolated-environment M0 execution evidence bundle is captured from the repository under the declared SELF_ATTESTED_INTEGRITY assurance tier.",
          "kind": "REAL_WORLD_PROOF"
        },
        {
          "id": "M0-C15",
          "description": "The independent M0 evidence verifier passes without modifying the captured bundle.",
          "kind": "REAL_WORLD_PROOF"
        },
        {
          "id": "M0-C16",
          "description": "A negative control proves the evidence verifier rejects a tampered or incomplete bundle.",
          "kind": "SAFETY"
        },
        {
          "id": "M0-C17",
          "description": "No secret or sensitive file is tracked.",
          "kind": "SAFETY"
        },
        {
          "id": "M0-C18",
          "description": "Documentation describes observed reality and labels uninspected infrastructure or assumptions.",
          "kind": "VERIFICATION"
        },
        {
          "id": "M0-C19",
          "description": "The human operator reviews the foundation, evidence, deferred work, and safety boundaries and records approval.",
          "kind": "SAFETY"
        },
        {
          "id": "M0-C20",
          "description": "The Forex T480 adapter remains catalog-locked, shared-core based, and read-only. It exposes no arbitrary command, deployment mutation, generic MT5 API, generic market-data, arbitrary account, or order surface; its sole MT5 exception is the fixed m1_mt5_demo_probe, which is Demo-only and exports exactly 720 closed EUR/USD H1 bars for M1 preparation.",
          "kind": "SAFETY"
        },
        {
          "id": "M0-C21",
          "description": "Four isolated read-only Triad-plus-domain reviews, bound to the current commit, configuration, verifier, contract, and real-world evidence, produce a deterministic completion recommendation.",
          "kind": "VERIFICATION"
        },
        {
          "id": "M0-C22",
          "description": "The repo-wide SELF_ATTESTED_INTEGRITY tier and its limitations are explicit, machine-validated, and protected by a fixed-job local runner signature, hashes, freshness, revision/configuration binding, tamper rejection, Triad review, and human approval.",
          "kind": "VERIFICATION"
        }
      ],
      "verification_commands": [
        {